item,type,area,climate,locale,difficulty,form,prep,cost,AF,comment,effect,lvl
Cargalen,Poison,Arnor,cool temperate,underground,hard,Moss,Liquid,45gp,0,"Cagalen‘s moist surface harbors are deadly nerve poison often used by assasins. Victims must save against a 4th level nerve poison; victims failing an RR by 01-50 loose feeling in and use of 1-2 extremities (hands and feet) for 1-100 days; with a failure of 51-100, the nerves in the extremity are reduced to useles pulp; failure 100+ results in death, as the victims nerves simpydissolve into a hot, pink liquid. Fortunately, the poison is easily broken by any of those herbs capable of repairing nerve damage.",,4
Carlong,Bone Repair,everywhere,mild temperate,short grass,extreme,Stalk,Brew,110gp,0,,"If the stalk is chopped and boiled for several hours, the thick soup that results can repair shattered bones and joints if ingested. The broken limb(s) must be placed in a proper position or they heal improperly. In addition, they must not be moved during 12 hours it takes for the heraling to be completed..",0
Caradhrain,Physical Alteration/Enhancement,everywhere,warm,tropical grasslands,hard,Root,Brew,65gp,0,"Unlike most other grasses, Caradhrain posses a lage tuber. The uses for this root are twofoled, and neither is anny good without the other. First it must be ground up and placed in boiling water (which is inbibed). Ath the same time, a second raradhrain root is place in the fire and allowed to blacken. It should then be  rubbed onto whatever body part the user wants to protect. Each root yields enoug oil for ½ of a human body. If both steps are undertaken by the same person, they find themselves totally protected from heat and flame for 1-0 hours, provided they do not whash or eat anything else (either being enough to negate the effect).
During this time , the subject may pass through normal fire without injury and handle red-hot metel up for 1 minute before experiencing  enough discomfort to put it down. The fire of a forge is hot enoigh to make him very uncomfortable; thet of a volcano or a dragon will kill him. He may be able to stand up to a Balrog, but not make contact, as the fire is of magical origin.",,0
Carnegurth,Poison,---,---,---,medium,Flower,Liquid,5sp,0,,Circulatory poison. RR failure by 51+ equals massive internal blood clotting and death in 1-100 hours. If RR fails by less check the results in table 11.2.3 Poison Descriptions Effect Descriptions.,1
Carnerem,Antidotes,---,mild temperate,freshwater coast and banks,hard,Leaf,Apply,8sp,0,,Delays any poison for 24 hours.,10
Carneyar,Concussion Relief,everywhere,mild temperate,short grass,absurd,Flower,Brew,250sp,5,If drawback occurs user is sluggish and slow (acts at -10) for 11-20 minutes after taking the herb.,Instantly heals all hits and stops all bleeding.,20
Carpet Moss,Bone Repair,Moria,cool temperate,underground,easy,Fungus,Apply,4sp,0,,Double the rate for healing fractures and aids in bone setting.,6
Cashdir,Antidotes,Greater Harad,arid,desert,hard,Flower,Ingest,54gp,0,,Antidote for muscle poison. Does not reverse any effects already taken but stops any further damage.,12
Cathaana,Poison,everywhere,mild temperate,decidous/mixed forest,very hard,Nut,Ingest,21sp,0,"A white powder prepared from Cathan, the nut of the cathanaur, a medium tree of the hickory family native to mild, temperate decidous and mixed forests. The cathanaur grows to about 18 m tall, frequently in multiple trunks, and has dark green leaves with nine leaflets that that resemble those of the pecan. Cathaana is prepared by roasting and crusching the cathan nuts. It can be deceptively deadly - even mild exposures instantly cause mild euphoria (-50 to actions for 1D10 rounds): extreme exposure destroy victims brain after 1D10 minutes. Note: if eaten raw, cathan nuts are mildly eophoric (-10 to actions for 1D10 minutes, addiction factor 5) but nontoxic.
If second RR is successful there is no harm to victim.","Nerve poison. ""Sly viper"" white powder that causes euphoria for 1-10 rounds thereafter victim acts normally for 1-10 minutes after which he has to roll another RR. If that fails by 26+ he dies instantly.",1
Chap Beech Nut,Nutrition/Refreshment,Mirkwood,mild temperate,decidous/mixed forest,medium,Nut,Ingest,4sp,0,,1 days nutrition.,10
Chekyuv,Circulatory Relief,eastern Endor,warm,freshwater coast and banks,easy,Lichen,Paste,1sp,0,,"If scraped off with a knife and spread immedeatley on a scratch or cut, it induces a slight feeling of  lethargy that last for 1 hour; the scracch fades and disapeares within 24 hours. The lichen has a slight effect on the healing of blood vessels and is used to sedate and stimulate the natural recovery process.",
Chebkuile,Life Preservation,---,---,---,absurd,Moss,Ingest,90sp,0,,Lifekeeping for 6-10 days unless heart is destroyed. Heart will continue to beat as victim enters a coma-like state. 75\\% chance of amnesia. Victim risks to forget a period of 1-12 months before he recieved the herb.,20
Chrume,Physical Alteration/Enhancement,---,---,---,medium,Mushroom,Ingest,15sp,0,Drawback indicate an addiction to the herb. See addiction rules in Gamemaster Law p. 90.,Imbiber has +20 to CO & PR for 1-10 hours. -10 to AG & QU for the same time period. Euphoric and addictive.,8
Cicino,General Purpose,Fangorn Forest,mild temperate,decidous/mixed forest,light,Leaf,Brew,7gp,0,,1 dose provide +40 RR vs disease for 3 days and will provide a second RR for anyone already incubated.,10
Cockfan,General Purpose,everywhere,arid,scrubland,light,Leaf,Brew,9sp,0,intact plans may be dired and used as fans.,"If crushed and boiledy, Cockfan leaves yield a bitter tea that dispells any type of nausea.",0
Coraco,Concussion Relief,Suza Sumar Rain Forest (Far Harad),hot and humid,jungle/rain forest,easy,Berries,Juice,90gp,0,"Coraco berries may be baked into smal tarts that are extremely sweet. Due to the cost of their procurement, this is generaly done as ostentatious show of status. The heat of baking destroys their medicinal value.","2 bucketfuls of coraco berries may be pressed to yieald 8 oz of clear juice that instantly heals any common wound (2d10 hits). 8 oz is the minimum dosage for any effect (i.e.,smaler doses do not cure lesser injuries). The juice keep its properties for 6 month.",0
Corfura,Pain Reduction,---,---,---,extreme,Root,Brew,30sp,10,,Powerful anaesthetic. The Corfura halves any penalties by effectively reducing the body's sensivity to pain. The effect is instant and last for 3 hours. Using more than 1 dose per 8 hour period is dangerous and user must make an RR. RR failure by 1-25 causes drowsiness (-25) for 3 hours while RR failures above 26 causes 3 hours of unconsciousness. AF failure causes the user to become sluggish and slow operating at -10 (subtracted from all actions but the herb still halves any penalties from wounds).,14
Craeg-Curfluin,Poison,---,---,---,absurd,Plant,Liquid,210sp,0,,Conversion poison. Magical poison extracted from Gargoyle blood. Very rare. RR failure by 1-15 causes unconsciousness for 1-10 rounds. RR failure by 16-30 confer a permanent coma and RR failure by 31+ turns victim to stone (also quite permanent).,7
Cram,Nutrition/Refreshment,Dwarven settlements,---,---,easy,Bread,Ingest,13bp,0,,Dwarven waybread. A 4 oz slice provide 1 days nutrition. A 10-slice loaf costs 13 sp. Keeps 7 weeks if stored dry. Tastes of mushrooms.,1
Creagach-Chnaimh,Poison,White Mountains,cold,mountains,folly,Juice,Contact,600gp,0,"The poisonous juice of cragach-chnaimh may be extracted by boiling the leaves and roots of an intact plant. This is a favourite poinson of assassins, because it keeps for days when applied to surfaces with which a victim might come into contact (e.g., bed.sheets, privies, inner surfacees of armor etc.) The juice affects individuals differently. A resistant victim (RR failure of 01-15) falls into a brief, unwaking sleep (1d10 rnds), while weaker individual (RR failure: 25-50) suffers a coma (1d10 minutes). Those resistant but badly exposed (RR fail 51-100) lose legs and arms (1-4) as these turn blue and archieve a stone like hardness. (1d10 rnds after exposure). Weak and badly exposed victims (RR fail 100+) suffer the same hardening effect on their entire bodies (1-2 rnds after exposure. ",,25
Crowtounge,Physical Alteration/Enhancement,everywhere,cool temperate,underground,hard,Fungus,Paste,50gp,0,"If ground up and mixed with a little water, crowtounge produces a thick paste, cold to the touch, which, when applied to the skin, renders the subjects invisible to night vision.",,0
Cuildolthore,Life Preservation,Grey Montains,cold,marshes/swamp,folly,Plant,Brew,845gp,0,,"Cuildolthor has the effect of a Lifekeeping spell, curing the gravest of injuries, repairing the most virulent deseases and reversing the most potent poisons. The herb remains poenten for up to a year if packed and stored in a white wine.",0
Culan,Antidotes,---,---,---,medium,Leaf,Brew,12sp,0,,Anti spasmodic. Reduce the effects of any poison. Every dose of Culan lowers the result by 1 degree of severity; i.e extreme become severe severe become moderate etc. Mild effects are cured immediately. Culan take 3 rounds to take effect.,6
Culkas,Burn/Exposure Relief,Greater Harad,arid,desert,medium,Leaf,Apply,35gp,0,,Heals 10 square feet of burns (any). 1 dose heals the effects of any type of burns (one critical). This herb completely negate any hit points and penalties taken from burns. Full healing take 1 hour but the wound is tender for a few more days. ,10
Curfalka,Muscle/Cartilage/Tendon Repair,southern Endor,mild temperate,marshes/swamp,extreme,Fruit,Ingest,45sp,0,,Fresh fruits if eaten will heal all muscle damage in 3-30 minutes but the herb is only fresh for 3 days. If made into a paste and preserved it heals a muscle damage in 8 hours when applied.,10
Curfalka,Muscle/Cartilage/Tendon Repair,southern Endor,mild temperate,marshes/swamp,extreme,Fruit,Paste,8sp,0,,Fresh fruits if eaten will heal all muscle damage in 3-30 minutes but the herb is only fresh for 3 days. If made into a paste and preserved it heals a muscle damage in 8 hours when applied.,10
Curuloth,Miscellangelous,Dagorlad,cool temperate,marshes/swamp,hard,Flower,Ingest,22gp,0,"Greatly values by apothecaries, curuloth may be used to fix the vital essences of herbs normally effectual only by ingestion, enabling these same properties to take imediate effect by means of salves or injections (with needle or dart). 5 blossoms are usually required to fix 1 dose of a given medicinal.",,0
Cusamar,Concussion Relief,northern Endor,cold,heath/scrub/moor,extreme,Flower,Ingest,30gp,3,,Heals 15-60 (10 + 5d10).,10
Cyclic Fever,Poison,---,---,---,medium,Ticks,Paste,3sp,0,,Reduction poison. Paste made from ticks. Causes 3-4 cycles of fever spread over 5-10 days. During fever periods (lasting 6-10 hours) victim is at -10 per 10 RR failure.,5
Dagmather,Muscle/Cartilage/Tendon Repair,everywhere,semi-arid,short grass,hard,Spine,Brew,14sp,0,,Heals all cartilage damage in one damaged body. Healing take 8 hours of rest for full effect. If target continue to work or travel during the healing it take 12 hours for full effect.,5
Darsurion,Concussion Relief,southeastern Endor,cold,mountains,light,Leaf,Apply,3cp,0,,Heals 1-6 hit points. ,3
Daxamas,Poison,---,---,---,folly,Leaves,Ingest,42sp,0,,"Muscle poison. Also named ""Sly Leaf"". The initial effects are often mild (or not even noticed) but this poisonous leaf causes a heart disease. If RR fails by 26+ the target will die in 1-100 days without warning.",3
Deadly Akra,Poison,everywhere,cold,underground,hard,Mushroom,Ingest,32gp,0,The flesh of this mushroom is a potent poison,,5
Deadly Milkwhite Trumpet,Poison,Mirkwood,mild temperate,decidous/mixed forest,folly,Flower,Contact/Inhalation ,1sp,0,,Respiratory poison. Causes nausea and headache (-15) for 1-10 hours on a RR failure of 1-25. On a higher failure follow the results in 11.2.3 Poison descriptions.,4
Deadly Milkwhite Trumpet,Poison,Mirkwood,mild temperate,decidous/mixed forest,folly,Seed,Ingest,1gp,0,,Respiratory poison. On a RR failure by 26+ coma for 1-10 days. A severe RR failure by 51+ equals death in 1-10 days.,10
Degiik,Life Preservation,everywhere,warm,ocean/saltwater shore,hard,Leaf,Ingest,150sp,0,,Stabilizes a victim with mortal wounds and keep him alive (heart beating) for 24 hours unless heart is detroyed. All healing herbs have full effect while under the influence of a Degiik.,10
Delrean,General Purpose,southeastern Endor,cold,coniferous forest,easy,Bark,Apply,1bp,0,,Repels any insect. Smells foul within a 50 feet radius.,3
Degik,Life Preservation,everywhere,hot and humid,ocean/saltwater shore,hard,Leaf,Ingest,100gp,0,,"If 1 of its terminal leaves is swallowd by one who is in need of serious medical attention, Degik helps to stabilize his condition for 24 hours. After this time, however, its potency expires; and so does the patient, if he bears a mortal injury and has  received no other help. While under the effects of the leaf, all other healing herbs and magics work at their maximum potency. Degik leaves keep for upt to 1 week before loosing they potency.",0
Desert Amber,Life Preservation,Mirror of Fire (Far Harad),arid,desert,very hard,Amber,Ingest,100gp,0,"The more powerful medicinal qualities oth Desert Amber are not generally known; consequently, the resin is most often sought simply for decorative purposes (jewelery, ornaments, statuary, etc) . It is widely believed to possess prophylactic virtues in warding of demons.","When crushed and finely powdered through special alchemical procedures, desert amber becomes a potent additive to medicinal compounds desinged to resist the onset of death. By itseld, the effects of the silvery resin a equivalent to Preservation II; when compounded with other substances of preservative virtue, Desert Amber enchances their effect to that of Livekeeping IM finally, if combined with other lifekeeping herb by an apothecary who understands the true nature and properties of the resin (a very rare occurence), the trapped potency of Almarens water is released  restoring 50-100 hit/dose of amber used.",0
Dinfuin,Poison,Mirkwood,mild temperate,decidous/mixed forest,very hard,Moss,Liquid,2gp,0,"When pressure is exerted upon it, Dinfuin exudes a volatile oil that causes amnesia. Depending on the victims Intellect, this condition lasts for 1-100 days and is rarely permanent (5\%).",,5
Domallow,Physical Alteration/Enhancement,everywhere,mild temperate,marshes/swamp,medium,Reed,Brew,15gp,0,,"Dogmallow reeds are not to hollow in the upper third of their lenght. If the center of that part of the stem is scraped out, boiled in water for 30 min and consumed, it slows the effect of poisons( 10x normal  speed).",0
Din fuinen,Poison,---,---,---,hard,Moss oil,Ingest,48sp,0,,Grows at the banks of Golduin in Mirkwood. Target failing by 1-25 will suffer total amnesia for 1 hour per 1 failure (i.e will forget anything that happened during the hours affected by the herb). Targets failing RR by 26+ will fall asleep for 2-20 hours and suffer amnesia for 2 hours per 1 failure.,8
Dolimor,Poison,---,---,---,very hard,Fungus,Ingest,62sp,0,,Respiratory poison. RR failure by 21+ causes lungs to fail. Victim is immobilized within 1-10 minutes and dies in 1-3 hours if no antidote is applied.,6
Draaf,Concussion Relief,eastern Endor,mild temperate,ocean/saltwater shore,easy,Leaf,Ingest,8bp,0,,Heals 1-10 for each of 2 consecutive rounds (i.e 2-20 hits total). ,4
Dragul,Combat Enhancement,Suza Sumar Rain Forest (Far Harad),hot and humid,jungle/rain forest,very hard,Root,Brew,11sp,15,If drawback occurs user will be at -30 after the initial positive effects. Drawback fades over the course of 2-20 hours.,Brew provide +10 to Combat maneuvers (including OB) Perceptions & Athletics for 1 hour.,10
Dragon Grass,Burn/Exposure Relief,Grey Montains,cool temperate,marshes/swamp,easy,Seed,Apply,3sp,0,,"If the seeds which appear in autumn are ground up and stread over a burn, they relieve pain for 12 hours. The seeds may be stored for up to 1 year.",0
Dung-Reveling Psarch,Drug,Mount Gundabad,cold,underground,hard,Fungus,Ingest,22gp,0,"If consumed, the flesh of this mushroom confers a mind-altering experience. The consumers perception skills function at -15 for 24 hours, but intelligence related rolls (with regard to everything except themselves) increase by +.  The fungi may dried and still retain its properties up to a month.",,0
Dugmuthur,Concussion Relief,---,---,---,light,Berry,Ingest,1sp,0,,Heals 10 hit points instantly.,1
Dwarwes Eyebright,Physical Alteration/Enhancement,White Mountains,mild temperate,grasslands,very hard,Flower,Brew,3gp,0,"When brewed into a tea and consumed, its flowers improve vision in dim and dark condiions (+50 sighting bonus; up to 50‘ night vision for men). They produce no effect in total darkness, but miners and other darkdwellers are grateful for any improvement in their limited vision.",,0
Dynallca,Poison,everywhere,hot and humid,freshwater coast and banks,light,Leaf,Paste,14gp,3,,Tan paste destroys hearing and gives 1-10 hits.,3
Ebur,Muscle/Cartilage/Tendon Repair,everywhere,mild temperate,ocean/saltwater shore,medium,Flower,Ingest,22gp,18,,Repairs sprains. All sprains even if ligament is completely torn will heal over a time period of 8 hours. Smaller sprains causing a penalty of less than or equal to -15 will heal in 1 hour.,4
Ecsasse,Physical Alteration/Enhancement,---,---,---,very hard,Clove,Brew,16sp,0,,Imbiber is immune to mind attacks and mind disease for the duration (1-10 hours).,12
Eddij,Life Preservation,Sirayn (Greater Harad),warm,decidous/mixed forest,folly,Berry,Juice,300sp,0,,Magical herb. Preserves life (i.e heart will continue to beat unless totally destroyed and target will enter a coma-like state) of a person threatened with imminent death. Duration varies with the level of the person that applies the herb 1 day per level.,19
Eddij,Life Preservation,Sirayn (Greater Harad),warm,grasslands,folly,Berry,Juice,300sp,0,,Magical herb. Preserves life (i.e heart will continue to beat unless totally destroyed and target will enter a coma-like state) of a person threatened with imminent death. Duration varies with the level of the person that applies the herb 1 day per level.,19
Edram,Muscle/Cartilage/Tendon Repair,everywhere,cold,freshwater coast and banks,folly,Moss,Apply,18sp,0,,Mends a broken bone when applied. The injured bone must be set before ingestion of the herb. ,12
Elbens Basket,Combat Enhancement,northwestern Endor,cool temperate,short grass,extreme,Root,Brew,3sp,5,If drawback occurs user will be at 50\\% activity after his round of double speed.,Heart stimulant. User may act at double speed (200\\% action) for one round. He may select this round freely within the span of 1 hour. Effect can only be used once per dose taken and no more than 3 doses can be taken simultaneously.,12
Eldaana,Antidotes,---,---,---,medium,Leaf,Brew,25sp,0,,Antidote for reduction poisons. Will reverse any effects of a reduction poison over the course of 1 hour. Also reverses the effects of >Ugliness of Orn< curse.,9
Eredena,Physical Alteration/Enhancement,Fangorn Forest,mild temperate,decidous/mixed forest,extreme,Bud,Ingest,9sp,5,If drawback occurs sideeffects of varying degree may take place: (1-50) user is speeded but after the 5 rounds of double speed has passed user will be at 50\\% for 5 rounds (51-70) no effect at all (71-90) no speed but instant unconsciousness for 1-10 hours (91-95) immediate heart failure results in organ damage; -50 for 6 days or (96-100) immediate death by heart attack.,"User is hasted (200\\% action) for 5 continous rounds. The ""hasted"" rounds must start within 5 minutes of taking the herb othervise it is forfeit.",16
Eeldrake,Muscle/Cartilage/Tendon Repair,everywhere,cool temperate,freshwater coast and banks,medium,Plant,Contact,5gp,0,"If inhaled, Eeldrak steam causes lightheadness and disorientation. Care must be exercised by others to keep the patient from accidentally stumbling into fire.","Although nearly impossible to uproot, Eeldrake is easily cut. If a large handful of still dripping Eeldake is placed on a roaring fire, the steam pours forth (10 min/lb of Eeldrake placed on the fire) has the capacity to heal any muscular injury if the affected region is held over the steam for 10 minutes. Once the plant dires out, it is useless. For this reason, healers usualy keep it covered in crocks of water.",0
Elendils Basket,Antidotes,northern Endor,cold,scrubland,light,Root,Brew,2sp,0,,Purifies foul tainted water and slows the effects of poisons by x10.,4
Estesaque,Physical Alteration/Enhancement,everywhere,mild temperate,short grass,medium,scrub,Juice,7gp,0,"Estesalque acts as a powerful anagesic, quartering the effects of imense pain. Its side effect, drwosiness, gives teh user a -10 penalty to Intuition and Agility bonusses for 4-5 hours.","Diluted in water, the juice Estesalque acts as a powerful analgesic, reducing the general effects of intense pain. The juice keeps for up to a year if placed in a tightly stopped bottle.",0
Etarka,Poison,---,---,---,medium,Fish,Liquid,16sp,0,When penalty reaches -100 (i.e in 10 days from poisoning) victim is incapacitated and waiting for death.,Conversion poison. Heart is embedded in sick tissue and fat. Foe is at a cumulative -10 per day that passes since his poisoning. Death in 10-100 days unless antidote is applied.,2
Faghiu,Physical Alteration/Enhancement,Rhudaur,cool temperate,mountains,absurd,Flower,Brew,400gp,10,Drawback will cause equally strong emotions but of other types: i.e hate anxiety fear sorrow etc in target.,Love potion made from the magical Vanimelda flower. If imbibed the target will be faithful and loving versus the one who administers the potion or has worn it close to his heart for a prolonged period of time. The effect will last for 1-100 days (1 day per 1 failure up to 100). For more rules on Love Potions see the Hands of the Healer p.147.,12
Fairyhair,Physical Alteration/Enhancement,everywhere,cold,mountains,very hard,Plant,Smoke,65gp,0,,"If collected, packed into a pipe and smoked, Fairyhair bestows total protection from the cold on the inhaler for a period of 6 hours. The hairs last for several month before losing their virtue.",0
Falsereg,Poison,---,---,---,extreme,Blood,Paste,8sp,0,,Nerve poison. Prepared from fish blood. RR failure by 01-25 results in concentration disorders loss of memory and anxiety causing a -1 per 1 failure penalty to all actions. Failure by 26+ also results in immediate internal bleeding (3 hits/rnd for 6-60 rounds).,1
Febfendu ,Organ Repair/Preservation,everywhere,mild temperate,freshwater coast and banks,medium,Root,Brew,42sp,10,Drawback indicate a permanent reduction of hearing ability even though hearing is restored.,Restores hearing regardless of how severe the damage to the ear is. Recovery time is between 8 hours and 1 week depending on the severity of the damage (GM discretion). ,8
Feduilas,Physical Alteration/Enhancement,---,---,---,hard,Flower,Smoke,11cp,15,Drawback indicate an addiction to the herb. See addiction rules in Gamemaster Law p. 90.,Intoxicant. Provide +20 to RR vs Mentalism and Essence but also -10 to Agility and Quickness stats for 1-5 hours.,6
Fek,Circulatory Relief,everywhere,hot and humid,ocean/saltwater shore,very hard,Nut,Brew,50gp,5,Each week after the first provide a -10 penalty to the Herb Lore roll when using.,Stops all bleeding wounds in one body. Take 1-10 rounds to take effect. Patient cannot be moved for 1 hour or bleeding will resume at half rate. The nut will keep a long time but once brewed it will only have full effect for 1 week.,10
Felmather,Physical Alteration/Enhancement,everywhere,mild temperate,ocean/saltwater shore,hard,Leaf,Ingest,50sp,15,Drawback will cause the attention of other maybe hostile beasts of the area.,Mental summons of 1 friend (folk or beast) within 300' per level of user. This herb also serve as a powerful coma relief awakening the comatose victim within 1-10 minutes of ingestion. ,7
Finchfeather,Physical Alteration/Enhancement,everywhere,cool temperate,coniferous forest,very hard,Flower,Ingest,33gp,0,"The possesor of this power must  consciously test himself, lest it  vanish without being aware of it.","When the floewr is eaten, the consumer gains the ability to discern true North by simply closing his eyes and concentrating. This power does not manifest itself unless tested (accidentally or otherwise) and lasts for 4-7 (3+d4) days.",0
Firebreath,Circulatory Relief,everywhere,mild temperate,short grass,medium,Fruit,Ingest,4gp,0,"The firebreath fruit is a favourite among those who enjoy spicy cuisine, adding it to food in fresh or dried form. Many carry a small stash with them in case their innkeeper has run out. Ingestion of the fruit has no medicinal effect except to relieve constipation.","If cut in half, rubbed with blood and placed on a wound , Firebreath produces suprisingly coool sensation, haltering bleeding, closing wounds, and instantly healing 1d10 hits; if not  pre-seasoned with blood, however, the resulting pain is so intenseas to nearly raise the dead. Firebreath must be fresh for its healing to be effective; dried fruit is only going to elicit curses, no matter how much pre-seasoning is performed.",0
Fishfeather,Concussion Relief,everywhere,mild temperate,freshwater coast and banks,medium,Leaf,Ingest,3gp,0,Dried out Fishfeather leaves lose their healing virtue.,Each plume heals 1d4 hits.,0
Fiis,Concussion Relief,---,---,---,easy,Resin,Apply,1cp,0,,Heals 1-6 hit points.,2
Flameroot,Concussion Relief,Moria,mild temperate,underground,medium,Tuft,Ingest,8bp,0,,Doubles the healing rate of concussion hits. Halves the recovery time for other herbs.,8
