item,type,area,climate,locale,difficulty,form,prep,cost,AF,comment,effect,lvl
Fleabane,General Purpose,White Mountains,cold,mountains,extreme,Leaves,Apply,3bp,0,,Repels blood sucking insects. Comes in powder and juice form. The powder keeps for several months while the juice must be used with one week.,10
Flur-rort,General Purpose,---,---,---,very hard,Flower,Liquid,40sp,0,,Antidote for nerve poisons. Will reverse all effects. The reversal take 1-10 minutes depending severity. This antidote cannot bring back anyone that has died as a result of poison.,14
Foxrose,Concussion Relief,everywhere,mild temperate,marshes/swamp,very hard,Flower,Ingest,5gp,0,"Renown for its beauty in many lands, Forxrose is a symbol of love; the gift of a bouquet may signify romantic intensions.",Eating a petal has the effect of curing d10+2 hits.,0
Fukavar,General Purpose,---,---,---,very hard,Flower,Smoke,22sp,20,Drawback awakens the interrest of someone else than desired. Perhaps a Faeris or other being of the twilight world?,Allows mental summons of 1 friend within 20 miles. The summons take 20 rounds to perform and user may NOT communicate with the summoned friend by use of this herb. The summoned friend will know the distance and direction towards his friend for 24 hours.,10
Furry Oak Acorn,Nutrition/Refreshment,---,---,---,medium,Nut,Ingest,12bp,0,,1 nut provide 1 days nutrition. However one cannot live for more than 7 days on Furry Oak Acorns without suffering nutrition shortage.,6
Gaifas,Physical Alteration/Enhancement,everywhere,mild temperate,grasslands,hard,Leaf,Ingest,9sp,0,"Ingestion of raw leaves causes internal bleeding (5th lvl; 1-50 hits). If the leaves are boiled however, they are a tasty addition to any meal and freshen the breath for 2 days.","When ground to a powder, wixed with vinegar into a paste and ingested, Gaifas fowers counteract the poisons Slota, Karfar, and Saewedhil. In the case of non-Elven saewedhil victims, however, they must be made to swallow the paste (which may present a problem, as it can paralize). Any Elf ingesting saewedhil would die before the antodote could be administered.",0
Galenaana,Poison,---,---,---,very hard,Leaf,Powder,63sp,0,,Respiratory poison. Green powder which kill elves on RR failure of 51+. Other races suffer a coma for 1-100 weeks if RR fail by 51+. The effects is othervise as noted in Gamemaster Law p.94.,9
Galenas,Physical Alteration/Enhancement,northwestern Endor,mild temperate,scrubland,medium,Leaf,Smoke,1bp,0,Drawback indicate an addiction to the herb. See addiction rules in Gamemaster Law p. 90.,Relaxing intoxicant. User feels happy but is slow and acts at -75 for 1-10 rounds. The euphoric feeling continue for 1-6 hours during which user is at a mere -10.,4
Gariig,Concussion Relief,everywhere,arid,desert,light,Cactus,Ingest,5sp,0,,Instantly heal 30 hit points.,6
Gartaan,Poison,---,---,---,folly,Waters,Ingest,35sp,0,,Conversion poison. Causes hemophilia. Any bleeding will be doubled until cured of the disease.,15
Gefnul,Concussion Relief,eastern Endor,arid,volcanic areas,hard,Lichen,Ingest,30sp,0,,Heals 100 hit points instantly.,12
Gildarion,Muscle/Cartilage/Tendon Repair,---,---,---,extreme,Leaf,Paste,110sp,5,Drawback indicate a lowered function of the healed organ such as persistent pain causing a permanent -5 penalty.,Major organ repair. Recovery time is 1-10 days depending on the severity of the wound. ,13
Golden Cress,Circulatory Relief,southern Gondor,mild temperate,freshwater coast and banks,very hard,Fern,Apply,10sp,0,,Stops bleeding up to 5 hits/rnd. Take 1-5 rounds to permanently seal one wound. If used on a wound bleeding more than 5 hits/rnd the Golden Cress will halve the bleeding for as long as the target remains still.,9
Goldenmint,Physical Alteration/Enhancement,everywhere,mild temperate,short grass,light,Leaf,Brew,2gp,0,"If prepared with boiling water, the calming agents in Goldenmint are neutralized, leaving only a minty aftertaste.","If placed in a scalding ( but not boiling) water and allowd to steep for 10 min, Goldenmint leaves may be brewed into a tea capable of relieving (though not actually healing) all but the worst pain",0
Gonhithui,Poison,Gorgoroth,arid,freshwater coast and banks,very hard,Plant,Powder,34gp,0,"If ground into a powder and mixed with a small amound of water, the lichen causes dehydration over the next 24 hours for anyone who ingests it. The most severs cases (RR failure by 101+), the victim dies from dysentry the folowing day. There is no known antodote for this toxin, but if the victim is kept warm and drinks nearly every waking moment, he may stave off its effects.",,9
Gorfang,Poison,---,---,---,folly,Moss,Liquid,31sp,0,,Nerve poison. Take immediate effect. RR failure by 1-50 results in random extremity being useless (-25 penalty) for 1 day per 10 failure. RR failure by 51+ results in dissolving of nerves. Victim is a vegetable until nerves are regenerated.,3
Gorfon,Nerve Repair,everywhere,arid,volcanic areas,very hard,Fruit,Ingest,101gp,0,Drawback causes user to go into sleep lasting for 11-20 hours.,Heals one nerve damage.,6
Gort,Physical Alteration/Enhancement,---,---,---,hard,Leaf,Ingest,13cp,5,Drawback indicate an addiction to the herb. See addiction rules in Gamemaster Law p. 90.,Narcotic intoxicant. User has +10 to Presence and Appearance stat-bonus for 2 hours. After that user will be at -50 to all activities for 1-10 hours.,5
Gramursh,Stun Relief,---,---,---,medium,Moss,Powder,6sp,0,,Stun Relief. When mixed with water and drunk this herb allows imbiber to reduce all stun and stun no parry results from critical injuries by 1 round.,10
Grapeleaf,Nutrition/Refreshment,---,---,---,very hard,Nectar,Ingest,7sp,0,Drawback mean target involuntarily falls asleep unless a RR vs the herbs level is made.,1 days nutrition. If taken before going to sleep it also causes dreams for 2 hours. The dreams often come true. Target has +50 bonus to Divination for these 2 hours.,12
Grelnixar,Poison,---,---,---,absurd,Leaves,Apply,50sp,0,,"Magical poison. Confer ""running death"". If RR fails victim goes mad in 3 rounds often with the result that he starts to run until exhaustion points are up. Whenever exhaustion points return the running will continue. If not stopped victim could actually run/starve himself to death. If RR succeed the poison has no effect at all.",5
Greneldar,Poison,southern Endor,cold,mountains,hard,Flower,Apply,66sp,0,,"Reduction poison. Touch causes rash and pains to the exposed skin and confer a -5 penalty per 10 failure (maximum -30) for 1-5 days. If Greneldar is instead ingested victim will ""burn inside"": a -50 penalty for 1-10 days or on a RR failure of 26+ death due to organ damage.",3
Grodloth,Life Preservation,Moria,cold,underground,absurd,Flower,Ingest,1000gp,0,,Preserves life and eliminates pain for those on the brink of death. Lasts for seven days.,22
Gulfbrake,Bone Repair,everywhere,mild temperate,ocean/saltwater shore,extreme,Algae,Brew,20gp,0,"If boiling water is used to prepare the fronds, no healing benefits result and the cast hardens to the shatter-proof strength of leather. Suits of armor have been made this way, but unforutately they are susceptible to decay after several weeks, ususally inopportune times. Misprepared in this fashin, the fronds gradually absorb water from atmosphere, eventually rendering the cast as heavy as plate mail before rotting away.","If heated in scalding (but not boiling) water, Gulfbreak leaves become adhesive and may be wrapped arround a broken bone, thus enabling a cast or coveringto totally encompass the wound. The juices of the fronds soak into the flesh of the broken limb, accelerate the healing (5x normal rate). The Gulfbrake wrapping hardens in 2 hours, becomming as strong as steel yet light as paper. Once the injury is healed, the cast mey be shattered with a blunt instrument. If the cast is removed or otherwise shattered before the full healing process has taken place, the limp may heal wrong and the patient may find himself permanently impaired. Peparing dired Gulfbrake leaves takes over 2 hours; fresh ones only 20 mins.",0
Gulperwash,General Purpose,everywhere,cold,underground,extreme,Fungus,Apply,320sp,0,,If placed on targets forhead the Gulperwash almost immediately (1-6 rounds) alleviates any affliction including the healing of a damaged organ.,15
Gumumiti,Stun Relief,southern Endor,hot and humid,jungle/rain forest,hard,Leaf,Ingest,1gp,0,"This tree is values for its lumber, which is water resistant and lighly priced for making boas, ships and furniture exposed to the elements.",The fresh leaves of the Gumumiti relieveor reduce the effects of being stunned by 2 rnds. If chewed or eaten.,0
Gursamel,Bone Repair,everywhere,cool temperate,short grass,extreme,Stalk,Apply,30gp,5,,Mends one broken bone. It take 6 hours of total rest (immobility) for full effect. If the victim is moved the herb will not take full effect (i.e some penalty will remain even when 6 hours has passed).,10
Gurth-nu-fuin,Poison,---,---,---,extreme,Virus,Anaerobic,41sp,0,,Disease. Causes severe nausea. Victim is at -75 for 1-100 hours. RR failure by 26+ causes death within 2-20 days unless a second RR is successful.,3
Gwin-win-Rynd,Poison,---,---,---,folly,Bat,Liquid,54sp,0,,Reduction poison. RR failure by 1-25 results in total (and permanent) paralysis of the entire body. RR failure by 26+ confers death.,2
Gylvir,Physical Alteration/Enhancement,everywhere,mild temperate,ocean/saltwater shore,very hard,Algae,Ingest,62sp,0,If drawback occurs user is not able to breathe air for the entire duration of the herb.,Enables imbiber to breathe under water for 4 hours. ,12
Harfy,Circulatory Relief,southeastern Endor,semi-arid,short grass,very hard,Resin,Apply,175gp,9,,Powerful herb that immediately and permanently closes one bleeding wound.,16
Harlindar,General Purpose,---,---,---,hard,Plant,Brew,24sp,0,Drawback need only be rolled for once during the entire treatment. If drawback occur child will be delivered safely but mother might die (10\\% risk depending on circumstances).,Assures safe childbirth. Harlindar tea shall be consumed one cup every morning the entire labor for full effect. The price noted covers a whole 9 months.,13
Harts Glory,Concussion Relief,everywhere,mild temperate,short grass,medium,Flower,Ingest,4gp,9,,"Each petal restores 2d4 hits when consumed fresh. The flowers may be dried if first soaked in a little blood from the person who intends to later use them; to anyone else they have no value. Fresh petals last for up to 2 weeks if kept moist. If a flower dries without being soaked in blood, its power to heal diminishes to 1-2 hits each. (4sp if dried)",0
Harwite,Concussion Relief,Fangorn Forest,mild temperate,decidous/mixed forest,extreme,Moss,Ingest,2sp,0,,Heals 1-50 hit points in one hour. Also mends small wounds (remove the penalty from one wound up to -10).,10
Healers Chanomile,Physical Alteration/Enhancement,southern Gondor,mild temperate,short grass,medium,Flower,Brew,7gp,0,A bouquet of these flowers is a sign of mourning in many communities. The local feeling is that they represent the sleep of death from which a loved one may awaken in another life.,"When brewed into a tea, the flowers of Chanomile induce a deep sleep, during which all healing is hastened (3x normal rate). The patient awakens ravenously hungry and usually in bad mood.",0
Heen,Poison,---,---,---,folly,Seeds,Ingest,18sp,0,,Circulatory poison. Instantly causes 5-50 hit points followed in 6 rounds by severe ulceration. Victim is at -10 per 10 failure (up to a maximum of -50) for 24 hours.,6
Hegheg,Muscle/Cartilage/Tendon Repair,---,---,---,folly,Root,Paste,14sp,0,,Heals one damaged cartilage in 8 hours.,11
Henuial,Poison,---,---,---,folly,Liquid,Inject,52sp,0,,Conversion poison. Yellow venom injected in blood stream. Victim starts to bleed from the eyes. If RR fails by 1-25 one eye is injured. RR failure by 26+ indicate both eyes damaged and foe permanently blind.,6
Hesguratu,Enchanted Breads,everywhere,cold,mountains,light,Bread,Ingest,45gp,10,"If drawback occurs user take an ""A"" Stress Critical simultaneously with the effect (only first round). Dwarves are immune to this drawback.",4 oz slice is one dose. Once eaten a person might increase his strength for one minute (6 rnds) within the next 24 hours. The strength gain provide +10 OB and double concussion hits delivered in melee combat.,6
Hevik,General Purpose,---,---,---,very hard,Leaves,Ingest,12sp,0,Drawback causes spastical cramps user will be out/prone for 1-10 rounds thereafter at -10 to all activity. Nerve damage.,Intoxicant. Induces sleep for 11-20 hours. RR vs 10th lvl if ingested. RR vs 3rd lvl if smoked.,10
Hiam,Nutrition/Refreshment,---,---,---,hard,Moss,Ingest,5bp,0,Drawback: outside the hillmen society some people are allergic to Hiam moss causing them to suffer convulsions and eventually dying a horribly torturous death if RR fails by 21+.,1 days nutrition. Those who ingest Hiam moss find themselves alert and vigorous for 24 hours. Can be used for max 4 consecutive days. After that time a user must rest (or be at -75 to all activity) for twice as many days as he have used the herb. ,6
Hiam Moss,Physical Alteration/Enhancement,Rhudaur,cool temperate,decidous/mixed forest,very hard,Moss,Brew,9gp,0,"Some people (01-25) are allergic to Hiam Moss and suffer greatly after ingesting the tea brewed from it, going though convulsions and eventually dying a horribly torturous death. No allergic Hillmen remain, the weak having been painfully weeded out long ago.","The ful hiam (Hillmen beserkers) have long known of this fungus, grewing a tea that endows them with extraordinary abilities. The tea functions as a mood elevator and can sustain an individual for a whole day without any other nourishment. Most who ingest the tea find themselves alert and vigorous for 24 hours. However, it cannot be used more than 4 consecutive days; after that, the imbiber must rest (-75) for a period equal 2x the time they were sustained. During this they are capable of little or no activity.",0
Hillbroom,General Purpose,everywhere,mild temperate,mountains,extreme,Fruit,Ingest,10gp,0,"Cut and polished, Hillbroom staves are carvings of great workmanship and are often worth a great deal.","(trunk right teisted) Eating the fruit restores 1d6 hitsm makes the consumer feel full and content, greatly alleviating any mental suffering they may be experiencing. In addition, it repairs damage to one organ, removes any body odor for 1 day and freshend the breath. If cooked the hillbroom fruit is delicious but has no other properties.",0
Hillbroom,General Purpose,everywhere,mild temperate,mountains,extreme,Fruit,Ingest,2sp,0,"Although it is possible to tell the two types of trees appart, the fruits from either are identical to teh eye. Care must be taken when purchasing them from vendors whose scruples are unknown.","(trunk left twisted) The fruit can cause great harm to the consumer, including intense nausea and cramps for 1-4 days (operate at -50 during this time), diarrhea and vomiting ervery time the subject attempts to eat anything. During this time, the victim also has extremely bad breath and his face breaks out in hives. Cooking thes only halves the duration of the torture.",0
Himros,Burn/Exposure Relief,---,---,---,very hard,Leaves,Apply,15sp,0,,Cures burns. Will heal the injuries from 1 wound in 8 hours (including penalties and hits). Also relieves Pangwood inflammation.,9
Hith-i-girith,Poison,---,---,---,hard,Leaf,Liquid,33sp,0,,Vapor from a live tree causes immediate and continuing sleep. Target cannot be awakened (except through magic or antidotes) and the sleep is permanent. Hard to find and extremely rare since the Hith-i-girith will only sustain for 12 hours after being harvested.,4
Hoak-Foer,General Purpose,middle Endor,arid,short grass,hard,Flower,Ingest,67gp,10,If drawback occurs the ingester of the herb suffer a temporary loss of movement for 1-10 weeks. During this period user is at -15 to all moving maneuvers.,Cures mental diseases in 1-6 days depending on severity. Will also cure mind loss (i.e stat loss in any non-physical stat). Stats temporary lowered by Stat Gain rolls or spells are increased by 1 point per day after the herb is ingested until it reach its former value. ,10
Hopper Mushrooms,Organ Repair/Preservation,Far Harad,hot and humid,jungle/rain forest,extreme,Mushroom,Brew,230gp,0,,When dried and crushed the nodules may be steeped in boiling water to produce a tea that repair any organ damage as well as producing 1d10 hours of nausea (leaving the imbiber at -50).,0
Hopperfoot,Concussion Relief,everywhere,hot and humid,jungle/rain forest,hard,Mushroom,Ingest,45gp,0,,"Hopperfoot mushrooms cure 2d10 hits, but also put the consumer into a deep sleep for 8 hours, during which time they become subject of uncontrollable flatulence.",0
Hugar,General Purpose,---,---,---,medium,Root,Ingest,1sp,10,Drawback equals the same effects as from a Mild circulatory poison.,Harmless circulatory poison. Causes sleep and deep unconsciousness within 6-12 rounds of ingesting. Sleep lasts for 1 hour per 10 failure but no longer than 3 hours maximum. 1 hours sleep equals 4. ,6
Hugburtun,Circulatory Relief,---,---,---,very hard,Fruit,Brew,90sp,0,,Immediately stops any form of bleeding. All wounds will close and stops internal bleeding stops. Hugburtun restores blood vessels to normality.,18
Hulmiikak,Poison,---,---,---,extreme,Ants,Paste,28sp,0,,Muscle poison. Made from desert ants. RR failure by 26+ causes victims eyesight to be grumbled and all actions to be at -25 for 1 day per 1 failure. If RR failure is 51+ the effect is permanent.,5
Iauthalion,Concussion Relief,everywhere,mild temperate,ocean/saltwater shore,hard,Fruit,Ingest,45gp,0,,"When eaten, Iauthalion fruits instanly restore 5d10 hits.",0
Ironbine,Concussion Relief,everywhere,mild temperate,ocean/saltwater shore,light,Onion,Ingest,3gp,0,"Costal people recognize that this plant, along with many others, plays an important role in helping to forstall dune erosion, and myn seaside communities have planted it intentionally --- not only to keep their beaches where they are but also to have a handy source of this herb.","When eaten, Ironbine instantly restores 2-10 hits. If ground, the ironbine bulb reverses the effect of the poison Acana. The frower is good for 1 Week after being picked. The powder, if dried, keeps for years.",0
Ironleaf,Burn/Exposure Relief,northern Endor,cold,mountains,very hard,Leaf,Paste,4gp,0,"The poultice also soothes the pain of poison willow, curing the injury withing 1 hour.","If dired, ground and mixed with water, Ironleaf may be appied as a poultice to heal any burn.",0
Igturfas,Poison,---,---,---,absurd,Snakes,Liquid,80sp,0,,Muscle poison. Causes convulsions and muscle spasms. RR failure by 26+ puts victim at -50 to all actions for 1 hour per 1 failure (up to a maximum of 50 hours). RR failure by 51+ equals death in 6 hours due to shock and heart failure.,8
Jadaras,Poison,---,---,---,medium,Grass,Brew,15sp,0,,A disease confered via the Jadar Grass. A victim who fails RR has his AG-stat lowered by 30. The stat does not begin to rise until a second RR is made. Victim is entitled to one RR each week. The disease have a 24 hour incubation period. Any stat loss below zero kills victim.,3
Januk-ty,Stun Relief,---,---,---,very hard,Root,Brew,6sp,0,,Stun Relief. Removes 3 rounds of stun or stun no parry from one critical. Duration is 12 hours or until first critical that causes stun.,11
Jegga,Poison,everywhere,mild temperate,volcanic areas,hard,Bats,Paste,32sp,0,,Respiratory poison. Gives off a notable smell. Causes 1-100 hit points immediately when entering blood system.,7
Jeggarukh,Poison,everywhere,mild temperate,underground,hard,Bats,Powder,71gp,3,,Black powder gives 10-100 hits.,6
Jitsu,Poison,everywhere,mild temperate,ocean/saltwater shore,medium,Clams,Liquid,34gp,0,,Yellow venom gives 5-50 hits,5
Jitsutyr,Poison,everywhere,mild temperate,ocean/saltwater shore,very hard,Clams,Paste,84sp,0,,Respiratory poison. Tan paste destroys lungs. Victim bleed from mouth and is instantly nearly incapacitated (-75). If RR failure is 21+ victim will die in 10-100 rounds (+CO-bonus).,2
Joef,General Purpose,middle Endor,cool temperate,freshwater coast and banks,light,Powder,Ingest,35sp,0,,Allows mental summons of 1 sentient friend from up to 1 mile'/lvl. The friend know that he has been summoned but has no obligation to go to the summoner (i.e he is in no way forced). The process take 3 rounds of concentration. The summoned friend will know the distance and direction towards his friend for 24 hours.,10
Jojojopo,Burn/Exposure Relief,everywhere,frigid,mountains,hard,Leaf,Apply,25gp,0,,Cures frostbite. Heals 2-20 hits resulting from cold.,6
Juth,Poison,everywhere,arid,desert,hard,Scorpion,Liquid,41gp,0,,insanity in 1-100 weeks; Nerve poison. Causes gradual insanity over 1 week (see Hands of the Healer p.112). Victim take 2-20 hits at the first round of poisoning. ,2
Kakduram,Organ Repair/Preservation,everywhere,hot and humid,jungle/rain forest,extreme,Fruit,Ingest,90gp,6,Drawback indicate a permanent reduction of hearing ability even though hearing is restored.,Restores hearing unless the ear is totally destroyed. ,11
Kaktu,Poison,Sirayn (Greater Harad),arid,desert,extreme,Flower,Liquid,8sp,0,,Muscle poison. Victim suffers muscle spasms. RR failure by 1-15 confers a -20 penalty and increased fumble range for all moving maneuvers by +3. RR failure by 16-30 confers a -30 penalty and increases fumble range by +5. RR failure by 31-50 confers a -50 penalty and increases fumble range by +10. RR failure by 51+ nearly incapacitate foe (-75). All results last for 2-20 hours. ,1
Kalmogs Spoor,Poison,Grey Montains,cold,mountains,hard,Leaves,Paste,10sp,0,,Nerve poison. Instantly causes 2-20 hit points. After the 24 hour incubation period victim is at -10 per 10 failure for 6-10 days. Maximum penalty is -50.,8
Karfar,Poison,Suza Sumar Rain Forest (Far Harad),arid,desert,extreme,Leaf,Paste,23sp,0,,Circulatory poison. Redish paste causes heart to shut down. On a result of extreme failure death will occur in 2-12 rounds. Othervise the effects follow the 11.2.3 Effect descriptions table in RM FRP Gamemaster Law.,7
Kargijak,Concussion Relief,Mordor,arid,desert,easy,Berry,Paste,6bp,50,If drawback occurs any non-orc user will be stunned for 1-2 rounds due to severe pain. The wound is certain to leave a scar in either case.,Berries from Mordor. Healing and rejuvenating effect: user instantly regains 20 hit points. ,4
Kaskamak,Combat Enhancement,---,---,---,absurd,Leaves,Ingest,8sp,0,,Chewing the leaves before combat ensures greater stamina and pain resistance. Add CON-bonus as a percentage to the characters hit total (equal to an Unpain spell lasting for 1 hour) and ignore any exhaustion points spenditure during this hour.,16
Kathkusa,Physical Alteration/Enhancement,everywhere,cold,tundra,light,Leaf,Ingest,4sp,15,"If drawback occurs user take an ""A"" Stress Critical simultaneously with the effect (only first round). Dwarves are immune to this drawback.",User gets +10 OB and deliver double concussion damage in melee for 1-10 rounds.,8
Kelventari,Burn/Exposure Relief,everywhere,cool temperate,tall grass,hard,Berry,Rub,19gp,0,,"1 dose heals the effects of a 1st or 2nd degree burn (one critical ""A"" take 1 hour ""B"" take 2 hours ""C"" take 4 hours ""D"" take 6 hours and ""E"" take 8 hours to heal). The herb also instantly relieves 1-10 hit points delivered by burns.",8
Kilmakur,Physical Alteration/Enhancement,southeastern Endor,hot and humid,short grass,extreme,Root,Brew,65gp,0,,Protects versus flame and heat for 1-10 hrs. Character has a +30 DB vs all heat attacks.,13
Kingsfoot,General Purpose,everywhere,mild temperate,decidous/mixed forest,very hard,Root,Liquid,12gp,0,Kingsfoot is one of the ingredients for the desease Grelnixar.,"If ground, mixed with wine and inbibed, the root is said to bring long and peaceful sleep. The subject awakens refreshed, their mental burdens and unnecessary worries are gone.",0
Kingslock,Organ Repair/Preservation,everywhere,mild temperate,mountains,extreme,Lichen,Ingest,34gp,0,Kingslock is also used as an antidote for the poinson Kly.,"If ground fresh and taken internally Kinglock can cure many organ damage. It is extremely fast-acting, completing its work withing 1 minute.",0
Kirsemal,Combat Enhancement,---,---,---,medium,Bark,Brew,2sp,0,"If drawback occurs user will have the option to abandon his Adrenal Move or take an ""A"" Stress Critical for the first round ""B"" for the second round and ""C"" for the third round.",Allows for Adrenal maneuvers to be prolonged for 3 consecutive rounds (must roll for skill each round). The effect of Kirsemal wears off after the adrenal move have been used or 12 hours pass (i.e Adrenal Move must be performed within 12 hours of intake).,9
Kirtir,Combat Enhancement,Arnor,mild temperate,freshwater coast and banks,hard,Buds,Inhale,2sp,0,If drawback occurs temp CO-value is reduced by 2-20 for 1-10 hours.,Powerful stimulant. Characters QU (stat bonus) is raised by +10 while AG is lowered by -5 for 1 hour. ,10
Kiseoboba,Physical Alteration/Enhancement,Far Harad,arid,desert,easy,Berries,Ingest,1sp,0,"When eaten, Kiseoboba bereits act upon the saliva glands, regulating their activity. Combined with a light numbing sensation, this allows the consumer the sensation of thirst.",,0
Klabas,Poison,---,---,---,medium,Buds,Ingest,40sp,0,,Nerve poison. Over a period of 1-10 hours victim increasingly suffers the effects from 11.2.3 Poison Effect descriptions table. When the initial incubation period has passed if the RR failure was 21+ victim will be incapacitated and uncapable to perform any actions (-100) until cured.,10
